{
  "$schema": "http://json-schema.org/draft-07/schema#",
  "$id": "https://winghostty.dev/schemas/verification/scenario.v1.json",
  "title": "winghostty verification scenario v1",
  "type": "object",
  "additionalProperties": false,
  "required": ["schema_version", "id", "title", "category", "runner", "timeout_seconds", "steps", "assertions", "artifacts"],
  "properties": {
    "schema_version": { "const": "winghostty.verification.scenario.v1" },
    "id": { "type": "string", "pattern": "^[a-z0-9][a-z0-9._-]+$" },
    "title": { "type": "string", "minLength": 1 },
    "category": {
      "enum": ["contract", "interaction", "performance", "accessibility", "packaging", "soak"]
    },
    "runner": {
      "type": "object",
      "additionalProperties": false,
      "required": ["os", "architecture", "capabilities"],
      "properties": {
        "os": { "type": "string", "minLength": 1 },
        "architecture": { "enum": ["x86_64", "aarch64"] },
        "capabilities": {
          "type": "array",
          "uniqueItems": true,
          "items": { "type": "string", "minLength": 1 }
        }
      }
    },
    "timeout_seconds": { "type": "integer", "minimum": 1 },
    "steps": {
      "type": "array",
      "minItems": 1,
      "items": {
        "type": "object",
        "additionalProperties": false,
        "required": ["id", "description"],
        "properties": {
          "id": { "type": "string", "pattern": "^[a-z0-9][a-z0-9._-]+$" },
          "description": { "type": "string", "minLength": 1 }
        }
      }
    },
    "assertions": {
      "type": "array",
      "minItems": 1,
      "items": {
        "type": "object",
        "additionalProperties": false,
        "required": ["id", "description"],
        "properties": {
          "id": { "type": "string", "pattern": "^[a-z0-9][a-z0-9._-]+$" },
          "description": { "type": "string", "minLength": 1 }
        }
      }
    },
    "artifacts": {
      "type": "array",
      "items": {
        "type": "object",
        "additionalProperties": false,
        "required": ["kind", "path"],
        "properties": {
          "kind": { "enum": ["result", "log", "trace", "screenshot", "package", "other"] },
          "path": { "type": "string", "minLength": 1 }
        }
      }
    }
  }
}
